{"entrypoint":{"argv":["bin/python","app/main.py"],"cwd":"."},"files":[{"path":"app/common.py","sha256":"3d5e190389cdc05b1af4063d906374444e0688ed284cb5bc7054f8b7cd857bac","size":2957},{"path":"app/health.py","sha256":"e762b4a3053a5867c171341dca90860f8d26a2401fee590ccf027aa4820752aa","size":5725},{"path":"app/main.py","sha256":"1f3f6e8773189c43655be1e857409ecc2aa63e25bfcdbc753e8bc2afe9cb59c8","size":3924},{"path":"pixi.lock","sha256":"cbeadb5841e0b9810c74730c48d100a393cf57419883e902ad11234467da1adb","size":130169},{"path":"pixi.toml","sha256":"33c5ad61ebb529843550020170cc739a2874f7e0d07be532a7e289403b8fde38","size":375}],"health":{"argv":["bin/python","app/health.py"],"cwd":".","expected_behavior":"counter-step-1","interval_ms":500,"kind":"ros2-probe-v1","probe_timeout_ms":5000,"startup_timeout_ms":30000},"lock":"pixi.lock","manifest":"pixi.toml","platform":"linux-64","release_id":"ros-counter-a-v1","runtime":{"environment":"default","minimum_pixi_version":"0.83.0"},"schema_version":1,"signing":{"algorithm":"Ed25519","key_id":"demo-publisher-1"}}